name,description,type
Acrylic Paints,"Versatile and fast-drying, suitable for various surfaces.",traditional
Oil Paints,"Rich in texture, ideal for depth and blending.",traditional
Watercolors,"Light and transparent, perfect for subtle color gradients.",traditional
Charcoal,Great for expressive lines and deep shading.,traditional
Graphite Pencils,Essential for sketching and detailed drawing.,traditional
Ink (Various Types),"Used for drawing, calligraphy, and washes.",traditional
Pastels (Oil and Soft),"Vibrant colors, suitable for blending and layering.",traditional
Colored Pencils,Ideal for detailed and colorful illustrations.,traditional
Canvas (Various Sizes),The classic surface for oil and acrylic painting.,traditional
Sketch Papers,A variety of weights and textures for different mediums.,traditional
Sculpting Clay,Various types for sculpting and modeling.,traditional
Fabrics,"There are cotton, silk, linen, velvet fabrics, and more. Fabrics are ideal for textile arts, mixed media, and fabric painting.",traditional
Beads,"There are glass, wooden, ceramic, metal, and plastic beads, which can be used for beadwork in jewelry making, embroidery, and decorative art.",traditional
Ribbons,"There are satin, grosgrain, organza, and lace ribbons. They are decorative elements in mixed media art, scrapbooking, and textile work.",traditional
Aluminum Foil,"Malleable and reflective, great for texture and sculptural effects.",non-traditional
Bottle Caps,Can be used for mosaic-like artwork and assemblage pieces.,non-traditional
Old CDs/DVDs,Reflective and versatile for multimedia art and installations.,non-traditional
Egg Cartons,Useful for three-dimensional effects and eco-friendly projects.,non-traditional
Magazine Cutouts,Ideal for collage work and color play in mixed media art.,non-traditional
Toothpicks,Perfect for miniature sculptures or texture in paintings.,non-traditional
Matchsticks,Can be used for miniature constructions or textural elements.,non-traditional
Straws,"Suitable for creating patterns, structures, and abstract pieces.",non-traditional
Old Books/Pages,"Can be used for collage, sculpture, or thematic artworks.",non-traditional
Fabric Scraps,Varied textures and colors for textile art and collages.,non-traditional
Buttons,Great for adding detail and texture to mixed media pieces.,non-traditional
Leaves and Twigs,Natural elements that offer organic shapes and textures.,non-traditional
Packing Peanuts,Lightweight and can be sculpted or used in installations.,non-traditional
Old Newspapers,"Versatile for papier-mâché, collage, and layered artwork.",non-traditional
Wine Corks,"Can be carved, painted, or assembled into creative designs.",non-traditional
Coffee Grounds,Adds texture and natural pigment to paintings and mixed media.,non-traditional
Tin Cans,"Can be cut, shaped, or used as molds for sculptural projects.",non-traditional
Old T-shirts or Clothes,Fabric can be repurposed for textile art or weaving.,non-traditional
Broken Jewelry,Pieces can be used for embellishments or mosaic-like artworks.,non-traditional
Feathers,Great for adding unique texture and visual interest.,non-traditional
Sea Shells,Perfect for decorative elements in sculptures or assemblage.,non-traditional
Puzzle Pieces,Ideal for creating textured surfaces or mosaic patterns.,non-traditional
Old Keys,Can be used in metal art or assemblage pieces.,non-traditional
Pine Cones,Suitable for natural-themed art and textural effects.,non-traditional
Used Light Bulbs,Can be painted or filled for decorative or sculptural artworks.,non-traditional
Cardboard Tubes,Versatile for construction and form-building in sculptures.,non-traditional
"Spices (e.g., Paprika, Turmeric)",Can be used as natural pigments or in texture work.,non-traditional
Plastic Bottles,"Can be cut, melted, or reshaped for various artistic purposes.",non-traditional
Bread Clips,Useful for small-scale mosaic or patterned art.,non-traditional
Balloons,Can be inflated or deflated for unique shapes and forms.,non-traditional
Cork Boards,Can be carved or used as a base for pinning or attaching items.,non-traditional
Old Glasses or Lenses,Lenses can create interesting visual effects in installations.,non-traditional
Kitchen Utensils,Can be incorporated for their shapes and textures in art pieces.,non-traditional
Computer Parts,Circuit boards and components for tech-themed art.,non-traditional
Vinyl Records,Can be melted or cut for artistic projects or installations.,non-traditional
Shoelaces,Versatile for creating linear elements or textural patterns.,non-traditional
Old Watches,"Watch parts can be used for intricate, steampunk-style artwork.",non-traditional
Ice Cream Sticks,Great for miniature structures or as elements in collage.,non-traditional
Cassette Tapes,Tape can be unraveled for unique linear or textured effects.,non-traditional
Keyboard Keys,Can be repurposed for mosaic or typographic art pieces.,non-traditional
Bike Chains,Suitable for industrial-style sculptures or metal artworks.,non-traditional
Toothbrushes,Can be used for interesting brush stroke effects in painting.,non-traditional
Soda Can Tabs,Ideal for creating metallic textures or chainmail-like art.,non-traditional
Used Teabags,Offer interesting textures and natural stains for paper art.,non-traditional
Scrabble Tiles,Perfect for incorporating text and numbers into art.,non-traditional
Sunglasses Lenses,Can create interesting visual effects with their tinted colors.,non-traditional
Popsicle Residues,The colored stains can be used for abstract art on paper.,non-traditional
Disposable Plates,"Can be cut, painted, or assembled into unique art pieces.",non-traditional
Guitar Strings,Suitable for creating musical-themed or linear sculptures.,non-traditional
Dried Flowers/Plants,Can add natural beauty and organic forms to artwork.,non-traditional
Light Switch Covers,Can be painted or decorated to create mini art canvases.,non-traditional
Old Tires,Can be repurposed into large scale outdoor sculptures.,non-traditional
Broken Electronics,Components can be upcycled into tech-inspired art.,non-traditional
Dental Floss,Useful for creating fine lines and details in mixed media art.,non-traditional